{
  "item_id": "FMARS-C16-2024-EQP012",
  "mission_id": "FMARS-C16-2024",
  "station": "FMARS",
  "item": "ATV tyre repair kit",
  "area": "Vehicles",
  "advice_type": "Bring Spare",
  "rationale": "One ATV had a flat tyre on arrival and the fleet needed tyres cannibalized during pre-sim triage. The brief's lesson is to bring a tyre repair kit.",
  "source_id": "SRC-hypatia-iii-brief",
  "source_citation": "SRC-hypatia-iii-brief, Part IV – Incident and emergency register, §4.1 Technical failures, lines 542-547, 'Lesson for Hypatia III' column; also §1.3 line 72",
  "confidence": "A",
  "verified_by": "ASG",
  "related_events": [
    "FMARS-C16-2024-EVT006"
  ]
}
