{
  "item_id": "FMARS-C16-2024-EQP003",
  "mission_id": "FMARS-C16-2024",
  "station": "FMARS",
  "item": "Generator oil filters",
  "area": "Tools & Spare Parts",
  "advice_type": "Bring Spare",
  "rationale": "The mission brief attributes a generator seizing on Day 4 to a long-overdue oil change and recommends including an oil filter in the pre-mission spare parts kit. The crew's own report (FLASHLINE-16 DAILY REPORT 08-07-2024) says a dirty air filter was the confirmed cause and the oil was replaced at the same time.",
  "source_id": "SRC-hypatia-iii-brief",
  "source_citation": "SRC-hypatia-iii-brief, Part I §1.3 Pre-mission checklist, line 69 ('oil, oil filter'); context: Part IV §4.1 Technical failures, lines 500-505; crew account: SRC-flashline-crew-reports, FLASHLINE-16 DAILY REPORT 08-07-2024 (Generator Repair item)",
  "confidence": "A",
  "verified_by": "ASG",
  "related_events": [
    "FMARS-C16-2024-EVT001"
  ]
}
